{
  "catalog_version": "2026-04-11-a",
  "zones": [
    {
      "zone_id": "gh-01-zone-a",
      "zone_type": "crop_zone",
      "priority": "must_have",
      "description": "주 재배 구역 A, 상단/하단 기후와 근권 2지점 감시"
    },
    {
      "zone_id": "gh-01-zone-b",
      "zone_type": "crop_zone",
      "priority": "must_have",
      "description": "주 재배 구역 B, zone-a와 동일한 대칭 구조"
    },
    {
      "zone_id": "gh-01-outside",
      "zone_type": "outside_weather",
      "priority": "must_have",
      "description": "외기 기준 weather station"
    },
    {
      "zone_id": "gh-01-nutrient-room",
      "zone_type": "nutrient_room",
      "priority": "should_have",
      "description": "양액기, 원수, 공급 헤더 모니터링"
    },
    {
      "zone_id": "gh-01-dry-room",
      "zone_type": "dry_room",
      "priority": "should_have",
      "description": "건고추 건조 및 저장 공간"
    }
  ],
  "sensors": [
    {
      "sensor_id": "gh-01-zone-a--air-temp-rh--01",
      "zone_id": "gh-01-zone-a",
      "sensor_type": "air_temp_rh",
      "measurement_fields": ["air_temp_c", "relative_humidity_pct"],
      "unit": "degC_pct",
      "raw_sample_seconds": 10,
      "ai_aggregation_seconds": 60,
      "priority": "must_have",
      "model_profile": "climate_combo_upper_canopy",
      "protocol": "rs485_modbus_rtu",
      "install_location": "zone-a ridge-side upper canopy",
      "calibration_interval_days": 180,
      "redundancy_group": "zone-a-climate",
      "quality_flags": ["stale", "outlier", "jump"]
    },
    {
      "sensor_id": "gh-01-zone-a--air-temp-rh--02",
      "zone_id": "gh-01-zone-a",
      "sensor_type": "air_temp_rh",
      "measurement_fields": ["air_temp_c", "relative_humidity_pct"],
      "unit": "degC_pct",
      "raw_sample_seconds": 10,
      "ai_aggregation_seconds": 60,
      "priority": "must_have",
      "model_profile": "climate_combo_lower_canopy",
      "protocol": "rs485_modbus_rtu",
      "install_location": "zone-a worker-height center aisle",
      "calibration_interval_days": 180,
      "redundancy_group": "zone-a-climate",
      "quality_flags": ["stale", "outlier", "jump"]
    },
    {
      "sensor_id": "gh-01-zone-a--co2--01",
      "zone_id": "gh-01-zone-a",
      "sensor_type": "co2",
      "measurement_fields": ["co2_ppm"],
      "unit": "ppm",
      "raw_sample_seconds": 30,
      "ai_aggregation_seconds": 60,
      "priority": "should_have",
      "model_profile": "co2_fixed_canopy",
      "protocol": "rs485_modbus_rtu",
      "install_location": "zone-a canopy center",
      "calibration_interval_days": 90,
      "redundancy_group": "zone-a-co2",
      "quality_flags": ["stale", "calibration_due"]
    },
    {
      "sensor_id": "gh-01-zone-a--par--01",
      "zone_id": "gh-01-zone-a",
      "sensor_type": "par",
      "measurement_fields": ["par_umol_m2_s"],
      "unit": "umol_m2_s",
      "raw_sample_seconds": 30,
      "ai_aggregation_seconds": 60,
      "priority": "must_have",
      "model_profile": "par_fixed_canopy",
      "protocol": "rs485_modbus_rtu",
      "install_location": "zone-a center line canopy top",
      "calibration_interval_days": 180,
      "redundancy_group": "zone-a-radiation",
      "quality_flags": ["flatline", "outlier"]
    },
    {
      "sensor_id": "gh-01-zone-a--substrate-moisture--01",
      "zone_id": "gh-01-zone-a",
      "sensor_type": "substrate_moisture",
      "measurement_fields": ["substrate_moisture_pct"],
      "unit": "pct",
      "raw_sample_seconds": 30,
      "ai_aggregation_seconds": 60,
      "priority": "must_have",
      "model_profile": "substrate_probe_primary",
      "protocol": "rs485_modbus_rtu",
      "install_location": "zone-a front irrigation line",
      "calibration_interval_days": 90,
      "redundancy_group": "zone-a-rootzone",
      "quality_flags": ["stale", "flatline"]
    },
    {
      "sensor_id": "gh-01-zone-a--substrate-moisture--02",
      "zone_id": "gh-01-zone-a",
      "sensor_type": "substrate_moisture",
      "measurement_fields": ["substrate_moisture_pct"],
      "unit": "pct",
      "raw_sample_seconds": 30,
      "ai_aggregation_seconds": 60,
      "priority": "must_have",
      "model_profile": "substrate_probe_secondary",
      "protocol": "rs485_modbus_rtu",
      "install_location": "zone-a rear irrigation line",
      "calibration_interval_days": 90,
      "redundancy_group": "zone-a-rootzone",
      "quality_flags": ["stale", "flatline"]
    },
    {
      "sensor_id": "gh-01-zone-a--substrate-temp--01",
      "zone_id": "gh-01-zone-a",
      "sensor_type": "substrate_temp",
      "measurement_fields": ["substrate_temp_c"],
      "unit": "degC",
      "raw_sample_seconds": 30,
      "ai_aggregation_seconds": 60,
      "priority": "should_have",
      "model_profile": "substrate_temp_probe",
      "protocol": "rs485_modbus_rtu",
      "install_location": "zone-a front irrigation line",
      "calibration_interval_days": 180,
      "redundancy_group": "zone-a-rootzone",
      "quality_flags": ["stale"]
    },
    {
      "sensor_id": "gh-01-zone-a--substrate-temp--02",
      "zone_id": "gh-01-zone-a",
      "sensor_type": "substrate_temp",
      "measurement_fields": ["substrate_temp_c"],
      "unit": "degC",
      "raw_sample_seconds": 30,
      "ai_aggregation_seconds": 60,
      "priority": "should_have",
      "model_profile": "substrate_temp_probe",
      "protocol": "rs485_modbus_rtu",
      "install_location": "zone-a rear irrigation line",
      "calibration_interval_days": 180,
      "redundancy_group": "zone-a-rootzone",
      "quality_flags": ["stale"]
    },
    {
      "sensor_id": "gh-01-zone-a--drain-ec-ph--01",
      "zone_id": "gh-01-zone-a",
      "sensor_type": "drain_ec_ph",
      "measurement_fields": ["drain_ec_ds_m", "drain_ph"],
      "unit": "ds_m_ph",
      "raw_sample_seconds": 60,
      "ai_aggregation_seconds": 300,
      "priority": "must_have",
      "model_profile": "drain_ec_ph_station",
      "protocol": "rs485_modbus_rtu",
      "install_location": "zone-a drain collection manifold",
      "calibration_interval_days": 30,
      "redundancy_group": "zone-a-drain",
      "quality_flags": ["stale", "outlier", "calibration_due"]
    },
    {
      "sensor_id": "gh-01-zone-a--drain-volume--01",
      "zone_id": "gh-01-zone-a",
      "sensor_type": "drain_volume",
      "measurement_fields": ["drain_volume_l"],
      "unit": "L",
      "raw_sample_seconds": 60,
      "ai_aggregation_seconds": 300,
      "priority": "must_have",
      "model_profile": "drain_flow_counter",
      "protocol": "pulse_counter",
      "install_location": "zone-a drain collection manifold",
      "calibration_interval_days": 180,
      "redundancy_group": "zone-a-drain",
      "quality_flags": ["missing", "jump"]
    },
    {
      "sensor_id": "gh-01-zone-a--crop-image-frame--01",
      "zone_id": "gh-01-zone-a",
      "sensor_type": "crop_image_frame",
      "measurement_fields": ["rgb_frame"],
      "unit": "image",
      "raw_sample_seconds": 300,
      "ai_aggregation_seconds": 300,
      "priority": "optional",
      "model_profile": "fixed_crop_camera",
      "protocol": "rtsp_onvif",
      "install_location": "zone-a north end overhead mount",
      "calibration_interval_days": 30,
      "redundancy_group": "zone-a-vision",
      "quality_flags": ["blur", "dark_frame", "communication_loss"]
    },
    {
      "sensor_id": "gh-01-zone-b--air-temp-rh--01",
      "zone_id": "gh-01-zone-b",
      "sensor_type": "air_temp_rh",
      "measurement_fields": ["air_temp_c", "relative_humidity_pct"],
      "unit": "degC_pct",
      "raw_sample_seconds": 10,
      "ai_aggregation_seconds": 60,
      "priority": "must_have",
      "model_profile": "climate_combo_upper_canopy",
      "protocol": "rs485_modbus_rtu",
      "install_location": "zone-b ridge-side upper canopy",
      "calibration_interval_days": 180,
      "redundancy_group": "zone-b-climate",
      "quality_flags": ["stale", "outlier", "jump"]
    },
    {
      "sensor_id": "gh-01-zone-b--air-temp-rh--02",
      "zone_id": "gh-01-zone-b",
      "sensor_type": "air_temp_rh",
      "measurement_fields": ["air_temp_c", "relative_humidity_pct"],
      "unit": "degC_pct",
      "raw_sample_seconds": 10,
      "ai_aggregation_seconds": 60,
      "priority": "must_have",
      "model_profile": "climate_combo_lower_canopy",
      "protocol": "rs485_modbus_rtu",
      "install_location": "zone-b worker-height center aisle",
      "calibration_interval_days": 180,
      "redundancy_group": "zone-b-climate",
      "quality_flags": ["stale", "outlier", "jump"]
    },
    {
      "sensor_id": "gh-01-zone-b--co2--01",
      "zone_id": "gh-01-zone-b",
      "sensor_type": "co2",
      "measurement_fields": ["co2_ppm"],
      "unit": "ppm",
      "raw_sample_seconds": 30,
      "ai_aggregation_seconds": 60,
      "priority": "should_have",
      "model_profile": "co2_fixed_canopy",
      "protocol": "rs485_modbus_rtu",
      "install_location": "zone-b canopy center",
      "calibration_interval_days": 90,
      "redundancy_group": "zone-b-co2",
      "quality_flags": ["stale", "calibration_due"]
    },
    {
      "sensor_id": "gh-01-zone-b--par--01",
      "zone_id": "gh-01-zone-b",
      "sensor_type": "par",
      "measurement_fields": ["par_umol_m2_s"],
      "unit": "umol_m2_s",
      "raw_sample_seconds": 30,
      "ai_aggregation_seconds": 60,
      "priority": "must_have",
      "model_profile": "par_fixed_canopy",
      "protocol": "rs485_modbus_rtu",
      "install_location": "zone-b center line canopy top",
      "calibration_interval_days": 180,
      "redundancy_group": "zone-b-radiation",
      "quality_flags": ["flatline", "outlier"]
    },
    {
      "sensor_id": "gh-01-zone-b--substrate-moisture--01",
      "zone_id": "gh-01-zone-b",
      "sensor_type": "substrate_moisture",
      "measurement_fields": ["substrate_moisture_pct"],
      "unit": "pct",
      "raw_sample_seconds": 30,
      "ai_aggregation_seconds": 60,
      "priority": "must_have",